{
  "$schema": "https://json-schema.org/draft/2020-12/schema",
  "$id": "https://jg.local/stitch-screen-manifest.schema.json",
  "title": "Stitch Screen Manifest",
  "type": "object",
  "additionalProperties": false,
  "required": [
    "schemaVersion",
    "contractKind",
    "setId",
    "surfaceId",
    "surfaceRole",
    "status",
    "extends",
    "targets",
    "ctaPriority",
    "states",
    "validation"
  ],
  "properties": {
    "schemaVersion": {
      "type": "string",
      "const": "1.1.0"
    },
    "contractKind": {
      "type": "string",
      "const": "screen-manifest"
    },
    "setId": {
      "type": "string",
      "minLength": 1
    },
    "surfaceId": {
      "type": "string",
      "minLength": 1
    },
    "surfaceRole": {
      "type": "string",
      "enum": ["root", "repeat", "independent", "shared"]
    },
    "status": {
      "type": "string",
      "enum": ["draft", "accepted", "historical"]
    },
    "extends": {
      "type": "string",
      "minLength": 1
    },
    "targets": {
      "type": "object",
      "additionalProperties": false,
      "required": ["prefabPath", "sceneRoots", "primaryContractPaths", "serializedOwners"],
      "properties": {
        "prefabPath": {
          "type": "string",
          "minLength": 1
        },
        "sceneRoots": {
          "type": "array",
          "items": {
            "type": "string",
            "minLength": 1
          }
        },
        "primaryContractPaths": {
          "type": "array",
          "items": {
            "type": "string",
            "minLength": 1
          }
        },
        "serializedOwners": {
          "type": "array",
          "items": {
            "type": "string",
            "minLength": 1
          }
        }
      }
    },
    "ctaPriority": {
      "type": "array",
      "items": {
        "type": "object",
        "additionalProperties": false,
        "required": ["id", "priority", "unityTargetPath", "outcome"],
        "properties": {
          "id": {
            "type": "string",
            "minLength": 1
          },
          "priority": {
            "type": "string",
            "enum": ["primary", "secondary", "tertiary"]
          },
          "unityTargetPath": {
            "type": "string",
            "minLength": 1
          },
          "outcome": {
            "type": "string",
            "minLength": 1
          }
        }
      }
    },
    "states": {
      "type": "object",
      "additionalProperties": {
        "type": "boolean"
      },
      "required": ["default"]
    },
    "validation": {
      "type": "object",
      "additionalProperties": false,
      "required": ["frame", "firstReadOrder", "requiredChecks", "smokeScripts"],
      "properties": {
        "frame": {
          "type": "string",
          "minLength": 1
        },
        "firstReadOrder": {
          "type": "array",
          "items": {
            "type": "string",
            "minLength": 1
          }
        },
        "requiredChecks": {
          "type": "array",
          "items": {
            "type": "string",
            "minLength": 1
          }
        },
        "smokeScripts": {
          "type": "array",
          "items": {
            "type": "string",
            "minLength": 1
          }
        }
      }
    },
    "blockOverrides": {
      "type": "object",
      "additionalProperties": {
        "type": "object",
        "additionalProperties": false,
        "properties": {
          "enabled": {
            "type": "boolean"
          },
          "sourceName": {
            "type": "string"
          },
          "unityTargetPath": {
            "type": "string"
          },
          "layout": {
            "$ref": "#/$defs/layout"
          },
          "children": {
            "type": "array",
            "items": {
              "type": "string",
              "minLength": 1
            }
          },
          "notes": {
            "type": "array",
            "items": {
              "type": "string"
            }
          }
        }
      }
    },
    "appendBlocks": {
      "type": "array",
      "items": {
        "$ref": "#/$defs/block"
      }
    },
    "notes": {
      "type": "array",
      "items": {
        "type": "string"
      }
    }
  },
  "$defs": {
    "block": {
      "type": "object",
      "additionalProperties": false,
      "required": [
        "blockId",
        "role",
        "sourceName",
        "unityTargetPath",
        "layout",
        "children"
      ],
      "properties": {
        "blockId": {
          "type": "string",
          "minLength": 1
        },
        "role": {
          "type": "string",
          "enum": [
            "root",
            "section",
            "repeat-item",
            "overlay",
            "cta",
            "content",
            "status",
            "shared-chrome"
          ]
        },
        "sourceName": {
          "type": "string",
          "minLength": 1
        },
        "unityTargetPath": {
          "type": "string",
          "minLength": 1
        },
        "layout": {
          "$ref": "#/$defs/layout"
        },
        "children": {
          "type": "array",
          "items": {
            "type": "string",
            "minLength": 1
          }
        }
      }
    },
    "layout": {
      "type": "object",
      "additionalProperties": false,
      "required": ["axis", "padding", "gap", "alignment", "sticky", "scroll"],
      "properties": {
        "axis": {
          "type": "string",
          "enum": ["vertical", "horizontal", "overlay", "free"]
        },
        "padding": {
          "type": "integer",
          "minimum": 0
        },
        "gap": {
          "type": "integer",
          "minimum": 0
        },
        "minHeight": {
          "type": "integer",
          "minimum": 0
        },
        "minWidth": {
          "type": "integer",
          "minimum": 0
        },
        "alignment": {
          "type": "string",
          "enum": ["start", "center", "end", "stretch"]
        },
        "sticky": {
          "type": "boolean"
        },
        "scroll": {
          "type": "boolean"
        }
      }
    }
  }
}
