{
  "schemaVersion": "1.1.0",
  "contractKind": "screen-manifest",
  "setId": "set-a",
  "surfaceId": "lobby-main-populated",
  "surfaceRole": "root",
  "status": "accepted",
  "extends": "lobby-root",
  "targets": {
    "prefabPath": "Assets/Prefabs/Features/Lobby/Root/LobbyPageRoot.prefab",
    "sceneRoots": [
      "/Canvas/LobbyPageRoot"
    ],
    "primaryContractPaths": [
      "/Canvas/LobbyPageRoot",
      "/Canvas/LobbyPageRoot/RoomListPanel",
      "/Canvas/LobbyPageRoot/RoomListPanel/RoomsSectionCard/ListHeaderRow",
      "/Canvas/LobbyPageRoot/RoomListPanel/RoomsSectionCard/RoomListSurface"
    ],
    "serializedOwners": [
      "/Canvas/LobbyPageRoot/LobbyView::LobbyView",
      "/Canvas/LobbyPageRoot/RoomListPanel::RoomListView",
      "/Canvas/LobbyPageRoot/RoomListPanel/GarageSummaryCard::LobbyGarageSummaryView"
    ]
  },
  "ctaPriority": [
    {
      "id": "join-highlighted-room",
      "priority": "primary",
      "unityTargetPath": "/Canvas/LobbyPageRoot/RoomListPanel/RoomsSectionCard/RoomListSurface/HighlightedRoom/JoinButton",
      "outcome": "join selected room"
    },
    {
      "id": "create-room",
      "priority": "secondary",
      "unityTargetPath": "/Canvas/LobbyPageRoot/CreateRoomCard/CreateRoomButton",
      "outcome": "open create room flow"
    },
    {
      "id": "open-garage",
      "priority": "tertiary",
      "unityTargetPath": "/Canvas/LobbyGarageNavBar/GarageTabButton",
      "outcome": "switch to garage page"
    }
  ],
  "states": {
    "default": true,
    "empty": false,
    "loading": false,
    "error": false,
    "selected": true,
    "disabled": false
  },
  "validation": {
    "frame": "390x844",
    "firstReadOrder": [
      "lobby-header-card",
      "rooms-section-card",
      "create-room-card",
      "garage-summary-card"
    ],
    "requiredChecks": [
      "contract",
      "room list first read order",
      "3 to 4 readable room rows",
      "highlighted join candidate visible"
    ],
    "smokeScripts": [
      "Invoke-LobbyGaragePageSwitchSmoke.ps1"
    ]
  },
  "blockOverrides": {
    "room-list-surface": {
      "notes": [
        "Render 3 to 4 compact tactical room rows instead of empty state.",
        "One room should read as the clearest join candidate."
      ]
    }
  },
  "appendBlocks": [],
  "notes": [
    "Accepted populated Lobby variant.",
    "Preserve the same hierarchy and language as the empty-state Lobby."
  ]
}
