{
  "schemaVersion": "1.1.0",
  "contractKind": "screen-manifest",
  "setId": "set-a",
  "surfaceId": "create-room-modal",
  "surfaceRole": "independent",
  "status": "accepted",
  "extends": "overlay-modal",
  "targets": {
    "prefabPath": "Assets/Prefabs/Features/Lobby/Independent/LobbyCreateRoomModal.prefab",
    "sceneRoots": [
      "/Canvas/LobbyCreateRoomModal"
    ],
    "primaryContractPaths": [
      "/Canvas/LobbyCreateRoomModal",
      "/Canvas/LobbyCreateRoomModal/OverlayCard"
    ],
    "serializedOwners": [
      "/Canvas/LobbyCreateRoomModal::CreateRoomModalView"
    ]
  },
  "ctaPriority": [
    {
      "id": "confirm-create-room",
      "priority": "primary",
      "unityTargetPath": "/Canvas/LobbyCreateRoomModal/OverlayCard/CreateButton",
      "outcome": "create room"
    },
    {
      "id": "cancel-create-room",
      "priority": "secondary",
      "unityTargetPath": "/Canvas/LobbyCreateRoomModal/OverlayCard/CancelButton",
      "outcome": "dismiss create room modal"
    }
  ],
  "states": {
    "default": true,
    "empty": false,
    "loading": false,
    "error": true,
    "selected": false,
    "disabled": true
  },
  "validation": {
    "frame": "390x844",
    "firstReadOrder": [
      "overlay-card",
      "primary-cta"
    ],
    "requiredChecks": [
      "contract",
      "lobby visible behind scrim",
      "compact room name, squad size, privacy controls"
    ],
    "smokeScripts": []
  },
  "blockOverrides": {
    "overlay-card": {
      "notes": [
        "Centered or lower-centered tactical modal with room name, squad size, and privacy/access controls.",
        "Integrated with populated lobby context, not a full-page replacement."
      ]
    },
    "primary-cta": {
      "unityTargetPath": "/Canvas/LobbyCreateRoomModal/OverlayCard/CreateButton",
      "notes": [
        "Primary create action uses Signal Orange and remains louder than cancel."
      ]
    }
  },
  "appendBlocks": [],
  "notes": [
    "Focused auxiliary overlay on top of populated lobby.",
    "Avoid generic app dialog styling."
  ]
}
